DR Scan: n_repeats=5, pv_max=80.0, rmse_max=0.15
Sensor: 2048x2048px
Sorting: True
GPU: True

  BL  PV=  0.5 seed=20260210 OK rmse=0.0346 6.7s
  BL  PV=  0.5 seed=20260211 OK rmse=0.0385 4.4s
  BL  PV=  0.5 seed=20260212 OK rmse=0.0170 4.0s
  BL  PV=  0.5 seed=20260213 OK rmse=0.0244 3.6s
  BL  PV=  0.5 seed=20260214 OK rmse=0.0390 3.0s
  ASM PV=  0.5 seed=20260210 OK rmse=0.0535 solver=asm_sorting_icp_gpu 6.3s
  ASM PV=  0.5 seed=20260211 OK rmse=0.0882 solver=asm_sorting_gpu 5.8s
  ASM PV=  0.5 seed=20260212 OK rmse=0.0715 solver=asm_sorting_icp_gpu 5.9s
  ASM PV=  0.5 seed=20260213 OK rmse=0.0722 solver=asm_sorting_gpu 5.8s
  ASM PV=  0.5 seed=20260214 OK rmse=0.0816 solver=asm_sorting_icp_gpu 5.1s
  => PV=0.5: BL_sr=1.00, ASM_sr=1.00

  BL  PV=  1.0 seed=20260210 OK rmse=0.0484 1.2s
  BL  PV=  1.0 seed=20260211 OK rmse=0.0633 3.8s
  BL  PV=  1.0 seed=20260212 OK rmse=0.0424 2.5s
  BL  PV=  1.0 seed=20260213 OK rmse=0.0506 2.7s
  BL  PV=  1.0 seed=20260214 OK rmse=0.0505 4.0s
  ASM PV=  1.0 seed=20260210 OK rmse=0.0467 solver=asm_sorting_icp_gpu 3.6s
  ASM PV=  1.0 seed=20260211 OK rmse=0.1024 solver=asm_sorting_icp_gpu 5.5s
  ASM PV=  1.0 seed=20260212 OK rmse=0.0635 solver=asm_sorting_gpu 4.5s
  ASM PV=  1.0 seed=20260213 OK rmse=0.0784 solver=asm_sorting_icp_gpu 4.7s
  ASM PV=  1.0 seed=20260214 OK rmse=0.0922 solver=asm_sorting_icp_gpu 4.5s
  => PV=1.0: BL_sr=1.00, ASM_sr=1.00

  BL  PV=  1.5 seed=20260210 OK rmse=0.0821 1.0s
  BL  PV=  1.5 seed=20260211 OK rmse=0.0906 3.0s
  BL  PV=  1.5 seed=20260212 OK rmse=0.0660 1.9s
  BL  PV=  1.5 seed=20260213 OK rmse=0.0961 3.4s
  BL  PV=  1.5 seed=20260214 OK rmse=0.0706 2.5s
  ASM PV=  1.5 seed=20260210 OK rmse=0.0499 solver=asm_sorting_icp_gpu 3.0s
  ASM PV=  1.5 seed=20260211 OK rmse=0.1243 solver=asm_sorting_icp_gpu 4.4s
  ASM PV=  1.5 seed=20260212 OK rmse=0.0715 solver=asm_sorting_gpu 3.8s
  ASM PV=  1.5 seed=20260213 OK rmse=0.0896 solver=asm_sorting_icp_gpu 5.0s
  ASM PV=  1.5 seed=20260214 OK rmse=0.1054 solver=asm_sorting_icp_gpu 4.1s
  => PV=1.5: BL_sr=1.00, ASM_sr=1.00

  BL  PV=  2.0 seed=20260210 OK rmse=0.1083 3.8s
  BL  PV=  2.0 seed=20260211 OK rmse=0.1223 3.2s
  BL  PV=  2.0 seed=20260212 OK rmse=0.0941 1.6s
  BL  PV=  2.0 seed=20260213 OK rmse=0.1112 1.1s
  BL  PV=  2.0 seed=20260214 OK rmse=0.0968 2.9s
  ASM PV=  2.0 seed=20260210 OK rmse=0.0745 solver=asm_sorting_gpu 5.7s
  ASM PV=  2.0 seed=20260211 OK rmse=0.1456 solver=asm_sorting_gpu 4.5s
  ASM PV=  2.0 seed=20260212 OK rmse=0.0889 solver=asm_sorting_gpu 3.4s
  ASM PV=  2.0 seed=20260213 OK rmse=0.1072 solver=asm_sorting_icp_gpu 2.9s
  ASM PV=  2.0 seed=20260214 OK rmse=0.1265 solver=asm_sorting_icp_gpu 4.9s
  => PV=2.0: BL_sr=1.00, ASM_sr=1.00

  BL  PV=  2.5 seed=20260210 OK rmse=0.1464 3.0s
  BL  PV=  2.5 seed=20260211 FAIL rmse=0.1542 3.0s
  BL  PV=  2.5 seed=20260212 OK rmse=0.1243 2.7s
  BL  PV=  2.5 seed=20260213 OK rmse=0.1373 1.8s
  BL  PV=  2.5 seed=20260214 OK rmse=0.1196 3.8s
  ASM PV=  2.5 seed=20260210 OK rmse=0.0865 solver=asm_sorting_icp_gpu 4.8s
  ASM PV=  2.5 seed=20260211 FAIL rmse=0.1750 solver=asm_sorting_icp_gpu 4.1s
  ASM PV=  2.5 seed=20260212 OK rmse=0.1151 solver=asm_sorting_icp_gpu 4.6s
  ASM PV=  2.5 seed=20260213 OK rmse=0.1337 solver=asm_sorting_gpu 3.5s
  ASM PV=  2.5 seed=20260214 FAIL rmse=0.1511 solver=asm_sorting_icp_gpu 5.4s
  => PV=2.5: BL_sr=0.80, ASM_sr=0.60

  BL  PV=  3.0 seed=20260210 FAIL rmse=0.1728 3.6s
  BL  PV=  3.0 seed=20260211 FAIL rmse=0.1809 0.2s
  BL  PV=  3.0 seed=20260212 OK rmse=0.1484 2.0s
  BL  PV=  3.0 seed=20260213 FAIL rmse=0.1675 2.6s
  BL  PV=  3.0 seed=20260214 OK rmse=0.1454 3.8s
  ** Baseline DR boundary: 2.5 lambda **
  ASM PV=  3.0 seed=20260210 OK rmse=0.1117 solver=asm_sorting_gpu 5.2s
  ASM PV=  3.0 seed=20260211 FAIL rmse=0.2058 solver=asm_sorting_gpu 1.1s
  ASM PV=  3.0 seed=20260212 OK rmse=0.1399 solver=asm_sorting_gpu 3.9s
  ASM PV=  3.0 seed=20260213 FAIL rmse=0.1703 solver=asm_sorting_icp_gpu 4.4s
  ASM PV=  3.0 seed=20260214 FAIL rmse=0.1830 solver=asm_sorting_icp_gpu 5.0s
  => PV=3.0: BL_sr=0.40, ASM_sr=0.40

  ASM PV=  3.5 seed=20260210 OK rmse=0.1256 solver=asm_sorting_gpu 5.5s
  ASM PV=  3.5 seed=20260211 FAIL rmse=0.2367 solver=asm_sorting_icp_gpu 1.2s
  ASM PV=  3.5 seed=20260212 FAIL rmse=0.1636 solver=asm_sorting_icp_gpu 3.7s
  ASM PV=  3.5 seed=20260213 FAIL rmse=0.2082 solver=asm_sorting_icp_gpu 5.8s
  ASM PV=  3.5 seed=20260214 FAIL rmse=0.1934 solver=asm_sorting_icp_gpu 1.5s
  => PV=3.5: BL_sr=0.00, ASM_sr=0.20

  ASM PV=  4.0 seed=20260210 OK rmse=0.1476 solver=asm_sorting_gpu 5.4s
  ASM PV=  4.0 seed=20260211 FAIL rmse=0.2658 solver=asm_sorting_icp_gpu 0.8s
  ASM PV=  4.0 seed=20260212 FAIL rmse=0.1896 solver=asm_sorting_icp_gpu 2.9s
  ASM PV=  4.0 seed=20260213 FAIL rmse=0.2428 solver=asm_sorting_icp_gpu 4.0s
  ASM PV=  4.0 seed=20260214 FAIL rmse=0.2116 solver=asm_sorting_gpu 1.4s
  => PV=4.0: BL_sr=0.00, ASM_sr=0.20

  ASM PV=  4.5 seed=20260210 FAIL rmse=0.1686 solver=asm_sorting_gpu 5.1s
  ASM PV=  4.5 seed=20260211 FAIL rmse=0.2899 solver=asm_sorting_icp_gpu 0.8s
  ASM PV=  4.5 seed=20260212 FAIL rmse=0.2166 solver=asm_sorting_icp_gpu 3.3s
  ASM PV=  4.5 seed=20260213 FAIL rmse=0.2790 solver=asm_sorting_gpu 5.4s
  ASM PV=  4.5 seed=20260214 FAIL rmse=0.2278 solver=asm_sorting_icp_gpu 1.0s
  => PV=4.5: BL_sr=0.00, ASM_sr=0.00

  ASM PV=  5.0 seed=20260210 FAIL rmse=0.1879 solver=asm_sorting_gpu 4.5s
  ASM PV=  5.0 seed=20260211 FAIL rmse=0.3285 solver=asm_sorting_gpu 0.7s
  ASM PV=  5.0 seed=20260212 FAIL rmse=0.2489 solver=asm_sorting_icp_gpu 3.1s
  ASM PV=  5.0 seed=20260213 FAIL rmse=0.3115 solver=asm_sorting_icp_gpu 3.7s
  ASM PV=  5.0 seed=20260214 FAIL rmse=0.2475 solver=asm_sorting_gpu 0.9s
  => PV=5.0: BL_sr=0.00, ASM_sr=0.00

  ASM PV= 10.0 seed=20260210 FAIL rmse=0.4594 solver=asm_sorting_icp_gpu 0.7s
  ASM PV= 10.0 seed=20260211 FAIL rmse=0.6303 solver=asm_sorting_gpu 0.5s
  ASM PV= 10.0 seed=20260212 FAIL rmse=0.5401 solver=asm_sorting_icp_gpu 0.6s
  ASM PV= 10.0 seed=20260213 FAIL rmse=0.5999 solver=asm_sorting_gpu 0.7s
  ASM PV= 10.0 seed=20260214 FAIL rmse=0.4831 solver=asm_sorting_icp_gpu 0.6s
  => PV=10.0: BL_sr=0.00, ASM_sr=0.00

  ASM PV= 15.0 seed=20260210 FAIL rmse=0.7661 solver=asm_sorting_icp_gpu 0.5s
  ASM PV= 15.0 seed=20260211 FAIL rmse=0.9466 solver=asm_sorting_gpu 0.6s
  ASM PV= 15.0 seed=20260212 FAIL rmse=0.7687 solver=asm_sorting_icp_gpu 0.8s
  ASM PV= 15.0 seed=20260213 FAIL rmse=0.8847 solver=asm_sorting_icp_gpu 0.8s
  ASM PV= 15.0 seed=20260214 FAIL rmse=0.7270 solver=asm_sorting_gpu 0.4s
  => PV=15.0: BL_sr=0.00, ASM_sr=0.00

  ASM PV= 20.0 seed=20260210 FAIL rmse=1.1608 solver=asm_sorting_icp_gpu 0.4s
  ASM PV= 20.0 seed=20260211 FAIL rmse=1.2322 solver=asm_sorting_icp_gpu 0.4s
  ASM PV= 20.0 seed=20260212 FAIL rmse=1.0191 solver=asm_sorting_icp_gpu 0.4s
  ASM PV= 20.0 seed=20260213 FAIL rmse=1.1598 solver=asm_sorting_icp_gpu 0.4s
  ASM PV= 20.0 seed=20260214 FAIL rmse=0.9714 solver=asm_sorting_gpu 0.4s
  => PV=20.0: BL_sr=0.00, ASM_sr=0.00

  ASM PV= 30.0 seed=20260210 FAIL rmse=1.7532 solver=asm_sorting_gpu 0.4s
  ASM PV= 30.0 seed=20260211 FAIL rmse=1.8525 solver=asm_sorting_gpu 0.4s
  ASM PV= 30.0 seed=20260212 FAIL rmse=1.4330 solver=asm_sorting_icp_gpu 0.3s
  ASM PV= 30.0 seed=20260213 FAIL rmse=1.7053 solver=asm_sorting_gpu 0.5s
  ASM PV= 30.0 seed=20260214 FAIL rmse=1.4858 solver=asm_sorting_gpu 0.4s
  => PV=30.0: BL_sr=0.00, ASM_sr=0.00
  ** ASM failed at PV=20.0 and PV=30.0, stopping **

======================================================================
DYNAMIC RANGE SCAN RESULTS
======================================================================
    PV  BL_pass  ASM_pass   ASM_rmse
----------------------------------------
   0.5      5/5       5/5     0.0734
   1.0      5/5       5/5     0.0766
   1.5      5/5       5/5     0.0881
   2.0      5/5       5/5     0.1086
   2.5      4/5       3/5     0.1118
   3.0      2/5       2/5     0.1258
   3.5      0/5       1/5     0.1256
   4.0      0/5       1/5     0.1476
   4.5      0/5       0/5        ---
   5.0      0/5       0/5        ---
  10.0      0/5       0/5        ---
  15.0      0/5       0/5        ---
  20.0      0/5       0/5        ---
  30.0      0/5       0/5        ---

Baseline DR: 2.5 lambda
ASM DR:      2.5 lambda
Gain:        1.0x FAIL (target >= 14x)
Total time:  4.9 minutes
