STAGE_START run_baseline config=configs/exp_dynamic_range_no_oracle_quick.yaml
Baseline PV=0.5: success_rate=1.00
Baseline PV=1.5: success_rate=1.00
Baseline PV=2.5: success_rate=0.80
Baseline PV=3.5: success_rate=0.00
Baseline PV=4.5: success_rate=0.00
Baseline PV=5.5: success_rate=0.00
Baseline PV=6.5: success_rate=0.00
Baseline PV=7.5: success_rate=0.00
Baseline PV=8.5: success_rate=0.00
Baseline PV=9.5: success_rate=0.00
Baseline PV=10.5: success_rate=0.00
Baseline PV=11.5: success_rate=0.00
SOLVER=baseline rows=60 out=outputs/tables/dynamic_range_no_oracle_quick_baseline_results.csv
STAGE_DONE run_baseline config=configs/exp_dynamic_range_no_oracle_quick.yaml
STAGE_START run_asm config=configs/exp_dynamic_range_no_oracle_quick.yaml
[1/60] PV=0.5 seed=20260210 OK rmse=0.0212 22.1s (ETA 21.7min)
[2/60] PV=0.5 seed=20260211 OK rmse=0.0401 16.7s (ETA 18.7min)
[3/60] PV=0.5 seed=20260212 OK rmse=0.0183 17.9s (ETA 18.0min)
[4/60] PV=0.5 seed=20260213 OK rmse=0.0235 17.4s (ETA 17.3min)
[5/60] PV=0.5 seed=20260214 OK rmse=0.0401 16.1s (ETA 16.5min)
[6/60] PV=1.5 seed=20260210 OK rmse=0.0289 14.9s (ETA 15.8min)
[7/60] PV=1.5 seed=20260211 OK rmse=0.0784 11.6s (ETA 14.7min)
[8/60] PV=1.5 seed=20260212 OK rmse=0.0496 15.2s (ETA 14.3min)
[9/60] PV=1.5 seed=20260213 OK rmse=0.1315 16.5s (ETA 14.0min)
[10/60] PV=1.5 seed=20260214 OK rmse=0.0959 13.8s (ETA 13.5min)
[11/60] PV=2.5 seed=20260210 OK rmse=0.1038 15.6s (ETA 13.2min)
[12/60] PV=2.5 seed=20260211 OK rmse=0.1238 8.5s (ETA 12.4min)
[13/60] PV=2.5 seed=20260212 OK rmse=0.1127 15.1s (ETA 12.1min)
[14/60] PV=2.5 seed=20260213 OK rmse=0.1480 14.6s (ETA 11.8min)
[15/60] PV=2.5 seed=20260214 OK rmse=0.1198 13.2s (ETA 11.5min)
[16/60] PV=3.5 seed=20260210 FAIL rmse=0.1794 13.6s (ETA 11.1min)
[17/60] PV=3.5 seed=20260211 FAIL rmse=0.1980 3.9s (ETA 10.4min)
[18/60] PV=3.5 seed=20260212 FAIL rmse=0.2241 11.6s (ETA 10.0min)
[19/60] PV=3.5 seed=20260213 FAIL rmse=0.1926 14.8s (ETA 9.8min)
[20/60] PV=3.5 seed=20260214 FAIL rmse=0.1816 7.1s (ETA 9.3min)
[21/60] PV=4.5 seed=20260210 FAIL rmse=0.2203 11.7s (ETA 9.0min)
[22/60] PV=4.5 seed=20260211 FAIL rmse=0.2600 2.9s (ETA 8.5min)
[23/60] PV=4.5 seed=20260212 FAIL rmse=0.2491 9.6s (ETA 8.2min)
[24/60] PV=4.5 seed=20260213 FAIL rmse=0.2785 11.6s (ETA 7.9min)
[25/60] PV=4.5 seed=20260214 FAIL rmse=0.2107 4.5s (ETA 7.5min)
[26/60] PV=5.5 seed=20260210 FAIL rmse=0.2689 6.6s (ETA 7.1min)
[27/60] PV=5.5 seed=20260211 FAIL rmse=0.3204 2.1s (ETA 6.7min)
[28/60] PV=5.5 seed=20260212 FAIL rmse=0.2739 8.3s (ETA 6.4min)
[29/60] PV=5.5 seed=20260213 FAIL rmse=0.2833 8.3s (ETA 6.2min)
[30/60] PV=5.5 seed=20260214 FAIL rmse=0.2672 3.3s (ETA 5.8min)
[31/60] PV=6.5 seed=20260210 FAIL rmse=0.3509 5.3s (ETA 5.5min)
[32/60] PV=6.5 seed=20260211 FAIL rmse=0.3901 1.8s (ETA 5.2min)
[33/60] PV=6.5 seed=20260212 FAIL rmse=0.3291 5.9s (ETA 4.9min)
[34/60] PV=6.5 seed=20260213 FAIL rmse=0.3437 5.8s (ETA 4.7min)
[35/60] PV=6.5 seed=20260214 FAIL rmse=0.3431 2.6s (ETA 4.4min)
[36/60] PV=7.5 seed=20260210 FAIL rmse=0.4362 4.4s (ETA 4.2min)
[37/60] PV=7.5 seed=20260211 FAIL rmse=0.4435 1.4s (ETA 3.9min)
[38/60] PV=7.5 seed=20260212 FAIL rmse=0.3864 5.1s (ETA 3.7min)
[39/60] PV=7.5 seed=20260213 FAIL rmse=0.4178 3.9s (ETA 3.5min)
[40/60] PV=7.5 seed=20260214 FAIL rmse=0.3501 2.1s (ETA 3.2min)
[41/60] PV=8.5 seed=20260210 FAIL rmse=0.4740 3.5s (ETA 3.0min)
[42/60] PV=8.5 seed=20260211 FAIL rmse=0.5532 1.3s (ETA 2.8min)
[43/60] PV=8.5 seed=20260212 FAIL rmse=0.4448 3.7s (ETA 2.6min)
[44/60] PV=8.5 seed=20260213 FAIL rmse=0.4767 3.2s (ETA 2.4min)
[45/60] PV=8.5 seed=20260214 FAIL rmse=1.1665 1.8s (ETA 2.2min)
[46/60] PV=9.5 seed=20260210 FAIL rmse=0.6099 2.8s (ETA 2.0min)
[47/60] PV=9.5 seed=20260211 FAIL rmse=0.5790 1.1s (ETA 1.9min)
[48/60] PV=9.5 seed=20260212 FAIL rmse=0.5163 2.6s (ETA 1.7min)
[49/60] PV=9.5 seed=20260213 FAIL rmse=0.5290 2.8s (ETA 1.5min)
[50/60] PV=9.5 seed=20260214 FAIL rmse=0.4574 1.5s (ETA 1.4min)
[51/60] PV=10.5 seed=20260210 FAIL rmse=0.5502 2.3s (ETA 1.2min)
[52/60] PV=10.5 seed=20260211 FAIL rmse=0.6285 1.2s (ETA 1.1min)
[53/60] PV=10.5 seed=20260212 FAIL rmse=0.5285 2.1s (ETA 0.9min)
[54/60] PV=10.5 seed=20260213 FAIL rmse=0.5981 2.4s (ETA 0.8min)
[55/60] PV=10.5 seed=20260214 FAIL rmse=1.2159 1.4s (ETA 0.6min)
[56/60] PV=11.5 seed=20260210 FAIL rmse=0.6611 1.8s (ETA 0.5min)
[57/60] PV=11.5 seed=20260211 FAIL rmse=0.6876 1.0s (ETA 0.4min)
[58/60] PV=11.5 seed=20260212 FAIL rmse=0.5967 1.9s (ETA 0.2min)
[59/60] PV=11.5 seed=20260213 FAIL rmse=0.6448 2.2s (ETA 0.1min)
[60/60] PV=11.5 seed=20260214 FAIL rmse=0.5640 1.3s (ETA 0.0min)

--- Per-PV Summary ---
ASM PV=0.5: sr=1.00, mean_rmse=0.0286
ASM PV=1.5: sr=1.00, mean_rmse=0.0769
ASM PV=2.5: sr=1.00, mean_rmse=0.1216
ASM PV=3.5: sr=0.00, mean_rmse=nan
ASM PV=4.5: sr=0.00, mean_rmse=nan
ASM PV=5.5: sr=0.00, mean_rmse=nan
ASM PV=6.5: sr=0.00, mean_rmse=nan
ASM PV=7.5: sr=0.00, mean_rmse=nan
ASM PV=8.5: sr=0.00, mean_rmse=nan
ASM PV=9.5: sr=0.00, mean_rmse=nan
ASM PV=10.5: sr=0.00, mean_rmse=nan
ASM PV=11.5: sr=0.00, mean_rmse=nan

SOLVER=asm rows=60 out=outputs/tables/dynamic_range_no_oracle_quick_asm_results.csv
STAGE_DONE run_asm config=configs/exp_dynamic_range_no_oracle_quick.yaml
============================================================
DYNAMIC RANGE EVALUATION
============================================================
Baseline DR:  1.5 waves (PV)
ASM DR:       2.5 waves (PV)
Range Gain:   1.7x
Target:       >= 14.0x
Result:       FAIL
============================================================

Per-PV breakdown:
    PV    BL_SR   ASM_SR    BL_RMSE   ASM_RMSE
--------------------------------------------------
   0.5     1.00     1.00     0.0307     0.0286
   1.5     1.00     1.00     0.0811     0.0769
   2.5     0.80     1.00     0.1319     0.1216
   3.5     0.00     0.00        nan        nan
   4.5     0.00     0.00        nan        nan
   5.5     0.00     0.00        nan        nan
   6.5     0.00     0.00        nan        nan
   7.5     0.00     0.00        nan        nan
   8.5     0.00     0.00        nan        nan
   9.5     0.00     0.00        nan        nan
  10.5     0.00     0.00        nan        nan
  11.5     0.00     0.00        nan        nan

Summary saved to outputs/tables/summary_metrics.csv
