STAGE_START no_oracle_quick_dynamic
STAGE_START run_baseline config=configs/exp_dynamic_range_no_oracle_quick.yaml
Baseline PV=0.5: success_rate=1.00
Baseline PV=1.5: success_rate=1.00
Baseline PV=2.5: success_rate=0.80
Baseline PV=3.5: success_rate=0.00
Baseline PV=4.5: success_rate=0.00
Baseline PV=5.5: success_rate=0.00
Baseline PV=6.5: success_rate=0.00
Baseline PV=7.5: success_rate=0.00
Baseline PV=8.5: success_rate=0.00
Baseline PV=9.5: success_rate=0.00
Baseline PV=10.5: success_rate=0.00
Baseline PV=11.5: success_rate=0.00
SOLVER=baseline rows=60 out=outputs/tables/dynamic_range_no_oracle_quick_baseline_results.csv
STAGE_DONE run_baseline config=configs/exp_dynamic_range_no_oracle_quick.yaml
STAGE_START run_asm config=configs/exp_dynamic_range_no_oracle_quick.yaml
[1/60] PV=0.5 seed=20260210 OK rmse=0.0348 21.8s (ETA 21.5min)
[2/60] PV=0.5 seed=20260211 OK rmse=0.0388 17.0s (ETA 18.8min)
[3/60] PV=0.5 seed=20260212 OK rmse=0.0172 18.2s (ETA 18.0min)
[4/60] PV=0.5 seed=20260213 OK rmse=0.0235 17.7s (ETA 17.4min)
[5/60] PV=0.5 seed=20260214 OK rmse=0.0377 16.2s (ETA 16.7min)
[6/60] PV=1.5 seed=20260210 OK rmse=0.0719 14.7s (ETA 15.8min)
[7/60] PV=1.5 seed=20260211 OK rmse=0.0840 11.6s (ETA 14.8min)
[8/60] PV=1.5 seed=20260212 OK rmse=0.0656 15.1s (ETA 14.3min)
[9/60] PV=1.5 seed=20260213 OK rmse=0.0938 16.5s (ETA 14.1min)
[10/60] PV=1.5 seed=20260214 OK rmse=0.0725 13.7s (ETA 13.5min)
[11/60] PV=2.5 seed=20260210 OK rmse=0.1236 15.9s (ETA 13.2min)
[12/60] PV=2.5 seed=20260211 OK rmse=0.1374 9.1s (ETA 12.5min)
[13/60] PV=2.5 seed=20260212 OK rmse=0.1255 15.0s (ETA 12.2min)
[14/60] PV=2.5 seed=20260213 OK rmse=0.1366 14.5s (ETA 11.9min)
[15/60] PV=2.5 seed=20260214 OK rmse=0.1367 13.3s (ETA 11.5min)
[16/60] PV=3.5 seed=20260210 FAIL rmse=0.2068 13.8s (ETA 11.2min)
[17/60] PV=3.5 seed=20260211 FAIL rmse=0.1980 3.9s (ETA 10.5min)
[18/60] PV=3.5 seed=20260212 FAIL rmse=0.1754 11.8s (ETA 10.1min)
[19/60] PV=3.5 seed=20260213 FAIL rmse=0.1926 14.9s (ETA 9.9min)
[20/60] PV=3.5 seed=20260214 FAIL rmse=0.1838 7.2s (ETA 9.4min)
[21/60] PV=4.5 seed=20260210 FAIL rmse=0.2203 12.2s (ETA 9.1min)
[22/60] PV=4.5 seed=20260211 FAIL rmse=0.2600 2.9s (ETA 8.5min)
[23/60] PV=4.5 seed=20260212 FAIL rmse=0.2288 9.7s (ETA 8.2min)
[24/60] PV=4.5 seed=20260213 FAIL rmse=0.2512 11.6s (ETA 8.0min)
[25/60] PV=4.5 seed=20260214 FAIL rmse=0.2107 4.5s (ETA 7.5min)
[26/60] PV=5.5 seed=20260210 FAIL rmse=0.2689 6.6s (ETA 7.2min)
[27/60] PV=5.5 seed=20260211 FAIL rmse=0.3204 2.2s (ETA 6.8min)
[28/60] PV=5.5 seed=20260212 FAIL rmse=0.2767 8.4s (ETA 6.5min)
[29/60] PV=5.5 seed=20260213 FAIL rmse=0.3088 8.5s (ETA 6.2min)
[30/60] PV=5.5 seed=20260214 FAIL rmse=0.2672 3.4s (ETA 5.9min)
[31/60] PV=6.5 seed=20260210 FAIL rmse=0.3224 5.2s (ETA 5.6min)
[32/60] PV=6.5 seed=20260211 FAIL rmse=0.3901 1.7s (ETA 5.2min)
[33/60] PV=6.5 seed=20260212 FAIL rmse=0.3608 5.8s (ETA 5.0min)
[34/60] PV=6.5 seed=20260213 FAIL rmse=0.3546 6.1s (ETA 4.7min)
[35/60] PV=6.5 seed=20260214 FAIL rmse=0.3431 2.9s (ETA 4.4min)
[36/60] PV=7.5 seed=20260210 FAIL rmse=0.3738 4.5s (ETA 4.2min)
[37/60] PV=7.5 seed=20260211 FAIL rmse=0.4435 1.5s (ETA 3.9min)
[38/60] PV=7.5 seed=20260212 FAIL rmse=0.3777 5.1s (ETA 3.7min)
[39/60] PV=7.5 seed=20260213 FAIL rmse=0.4178 3.9s (ETA 3.5min)
[40/60] PV=7.5 seed=20260214 FAIL rmse=0.3501 2.2s (ETA 3.3min)
[41/60] PV=8.5 seed=20260210 FAIL rmse=0.4263 3.5s (ETA 3.0min)
[42/60] PV=8.5 seed=20260211 FAIL rmse=0.5532 1.3s (ETA 2.8min)
[43/60] PV=8.5 seed=20260212 FAIL rmse=0.4448 3.7s (ETA 2.6min)
[44/60] PV=8.5 seed=20260213 FAIL rmse=0.4832 3.2s (ETA 2.4min)
[45/60] PV=8.5 seed=20260214 FAIL rmse=1.1665 1.7s (ETA 2.2min)
[46/60] PV=9.5 seed=20260210 FAIL rmse=0.4814 2.9s (ETA 2.1min)
[47/60] PV=9.5 seed=20260211 FAIL rmse=0.5790 1.2s (ETA 1.9min)
[48/60] PV=9.5 seed=20260212 FAIL rmse=0.5163 2.6s (ETA 1.7min)
[49/60] PV=9.5 seed=20260213 FAIL rmse=0.5402 2.8s (ETA 1.5min)
[50/60] PV=9.5 seed=20260214 FAIL rmse=0.4574 1.5s (ETA 1.4min)
[51/60] PV=10.5 seed=20260210 FAIL rmse=0.5989 2.4s (ETA 1.2min)
[52/60] PV=10.5 seed=20260211 FAIL rmse=0.6285 1.2s (ETA 1.1min)
[53/60] PV=10.5 seed=20260212 FAIL rmse=0.5285 2.2s (ETA 0.9min)
[54/60] PV=10.5 seed=20260213 FAIL rmse=0.5981 2.5s (ETA 0.8min)
[55/60] PV=10.5 seed=20260214 FAIL rmse=1.2159 1.4s (ETA 0.6min)
[56/60] PV=11.5 seed=20260210 FAIL rmse=0.6611 1.9s (ETA 0.5min)
[57/60] PV=11.5 seed=20260211 FAIL rmse=0.6876 1.0s (ETA 0.4min)
[58/60] PV=11.5 seed=20260212 FAIL rmse=0.5852 1.9s (ETA 0.2min)
[59/60] PV=11.5 seed=20260213 FAIL rmse=0.6448 2.2s (ETA 0.1min)
[60/60] PV=11.5 seed=20260214 FAIL rmse=0.5640 1.3s (ETA 0.0min)

--- Per-PV Summary ---
ASM PV=0.5: sr=1.00, mean_rmse=0.0304
ASM PV=1.5: sr=1.00, mean_rmse=0.0776
ASM PV=2.5: sr=1.00, mean_rmse=0.1320
ASM PV=3.5: sr=0.00, mean_rmse=nan
ASM PV=4.5: sr=0.00, mean_rmse=nan
ASM PV=5.5: sr=0.00, mean_rmse=nan
ASM PV=6.5: sr=0.00, mean_rmse=nan
ASM PV=7.5: sr=0.00, mean_rmse=nan
ASM PV=8.5: sr=0.00, mean_rmse=nan
ASM PV=9.5: sr=0.00, mean_rmse=nan
ASM PV=10.5: sr=0.00, mean_rmse=nan
ASM PV=11.5: sr=0.00, mean_rmse=nan

SOLVER=asm rows=60 out=outputs/tables/dynamic_range_no_oracle_quick_asm_results.csv
STAGE_DONE run_asm config=configs/exp_dynamic_range_no_oracle_quick.yaml
============================================================
DYNAMIC RANGE EVALUATION
============================================================
Baseline DR:  1.5 waves (PV)
ASM DR:       2.5 waves (PV)
Range Gain:   1.7x
Target:       >= 14.0x
Result:       FAIL
============================================================

Per-PV breakdown:
    PV    BL_SR   ASM_SR    BL_RMSE   ASM_RMSE
--------------------------------------------------
   0.5     1.00     1.00     0.0307     0.0304
   1.5     1.00     1.00     0.0811     0.0776
   2.5     0.80     1.00     0.1319     0.1320
   3.5     0.00     0.00        nan        nan
   4.5     0.00     0.00        nan        nan
   5.5     0.00     0.00        nan        nan
   6.5     0.00     0.00        nan        nan
   7.5     0.00     0.00        nan        nan
   8.5     0.00     0.00        nan        nan
   9.5     0.00     0.00        nan        nan
  10.5     0.00     0.00        nan        nan
  11.5     0.00     0.00        nan        nan

Summary saved to outputs/tables/summary_metrics.csv
STAGE_DONE no_oracle_quick_dynamic
STAGE_START no_oracle_quick_missing
STAGE_START run_baseline config=configs/exp_missing_spot_no_oracle_quick.yaml
Baseline PV=2.0 MR=0.0: sr=1.00
Baseline PV=2.0 MR=0.1: sr=1.00
Baseline PV=2.0 MR=0.3: sr=1.00
Baseline PV=2.0 MR=0.5: sr=0.80
Baseline PV=5.0 MR=0.0: sr=0.00
Baseline PV=5.0 MR=0.1: sr=0.00
Baseline PV=5.0 MR=0.3: sr=0.00
Baseline PV=5.0 MR=0.5: sr=0.00
Baseline PV=8.0 MR=0.0: sr=0.00
Baseline PV=8.0 MR=0.1: sr=0.00
Baseline PV=8.0 MR=0.3: sr=0.00
Baseline PV=8.0 MR=0.5: sr=0.00
Baseline PV=10.0 MR=0.0: sr=0.00
Baseline PV=10.0 MR=0.1: sr=0.00
Baseline PV=10.0 MR=0.3: sr=0.00
Baseline PV=10.0 MR=0.5: sr=0.00
SOLVER=baseline rows=80 out=outputs/tables/missing_spot_no_oracle_quick_baseline_results.csv
STAGE_DONE run_baseline config=configs/exp_missing_spot_no_oracle_quick.yaml
STAGE_START run_asm config=configs/exp_missing_spot_no_oracle_quick.yaml
[1/80] PV=2.0 seed=20260210 OK rmse=0.1083 20.0s (ETA 26.4min)
[2/80] PV=2.0 seed=20260211 OK rmse=0.1088 10.3s (ETA 19.7min)
[3/80] PV=2.0 seed=20260212 OK rmse=0.0944 14.4s (ETA 19.2min)
[4/80] PV=2.0 seed=20260213 OK rmse=0.1134 14.0s (ETA 18.6min)
[5/80] PV=2.0 seed=20260214 OK rmse=0.0970 13.4s (ETA 18.0min)
[6/80] PV=2.0 seed=20260210 OK rmse=0.0983 15.3s (ETA 18.0min)
[7/80] PV=2.0 seed=20260211 OK rmse=0.1130 9.5s (ETA 16.8min)
[8/80] PV=2.0 seed=20260212 OK rmse=0.0950 13.0s (ETA 16.5min)
[9/80] PV=2.0 seed=20260213 OK rmse=0.1157 13.0s (ETA 16.2min)
[10/80] PV=2.0 seed=20260214 OK rmse=0.1051 11.9s (ETA 15.7min)
[11/80] PV=2.0 seed=20260210 OK rmse=0.0980 11.9s (ETA 15.4min)
[12/80] PV=2.0 seed=20260211 OK rmse=0.1077 5.5s (ETA 14.4min)
[13/80] PV=2.0 seed=20260212 OK rmse=0.0945 10.4s (ETA 14.0min)
[14/80] PV=2.0 seed=20260213 OK rmse=0.1125 9.9s (ETA 13.6min)
[15/80] PV=2.0 seed=20260214 OK rmse=0.1083 10.2s (ETA 13.2min)
[16/80] PV=2.0 seed=20260210 OK rmse=0.0993 7.8s (ETA 12.7min)
[17/80] PV=2.0 seed=20260211 OK rmse=0.1128 4.0s (ETA 12.0min)
[18/80] PV=2.0 seed=20260212 OK rmse=0.0996 7.8s (ETA 11.6min)
[19/80] PV=2.0 seed=20260213 OK rmse=0.1115 7.4s (ETA 11.2min)
[20/80] PV=2.0 seed=20260214 OK rmse=0.1043 7.6s (ETA 10.9min)
[21/80] PV=5.0 seed=20260210 FAIL rmse=0.2472 10.3s (ETA 10.7min)
[22/80] PV=5.0 seed=20260211 FAIL rmse=0.3026 2.5s (ETA 10.1min)
[23/80] PV=5.0 seed=20260212 FAIL rmse=0.2586 9.1s (ETA 9.9min)
[24/80] PV=5.0 seed=20260213 FAIL rmse=0.2814 9.1s (ETA 9.7min)
[25/80] PV=5.0 seed=20260214 FAIL rmse=0.2286 3.8s (ETA 9.2min)
[26/80] PV=5.0 seed=20260210 FAIL rmse=0.2462 7.0s (ETA 9.0min)
[27/80] PV=5.0 seed=20260211 FAIL rmse=0.3026 2.3s (ETA 8.6min)
[28/80] PV=5.0 seed=20260212 FAIL rmse=0.2561 8.1s (ETA 8.3min)
[29/80] PV=5.0 seed=20260213 FAIL rmse=0.2814 7.5s (ETA 8.1min)
[30/80] PV=5.0 seed=20260214 FAIL rmse=0.2312 3.6s (ETA 7.8min)
[31/80] PV=5.0 seed=20260210 FAIL rmse=0.3084 5.5s (ETA 7.5min)
[32/80] PV=5.0 seed=20260211 FAIL rmse=0.2987 2.0s (ETA 7.2min)
[33/80] PV=5.0 seed=20260212 FAIL rmse=0.2580 6.4s (ETA 7.0min)
[34/80] PV=5.0 seed=20260213 FAIL rmse=0.2814 6.1s (ETA 6.8min)
[35/80] PV=5.0 seed=20260214 FAIL rmse=0.2283 3.0s (ETA 6.5min)
[36/80] PV=5.0 seed=20260210 FAIL rmse=0.3206 4.0s (ETA 6.3min)
[37/80] PV=5.0 seed=20260211 FAIL rmse=0.2789 1.7s (ETA 6.0min)
[38/80] PV=5.0 seed=20260212 FAIL rmse=0.2585 5.1s (ETA 5.8min)
[39/80] PV=5.0 seed=20260213 FAIL rmse=0.2744 4.4s (ETA 5.6min)
[40/80] PV=5.0 seed=20260214 FAIL rmse=0.2376 2.3s (ETA 5.4min)
[41/80] PV=8.0 seed=20260210 FAIL rmse=0.4554 3.9s (ETA 5.2min)
[42/80] PV=8.0 seed=20260211 FAIL rmse=0.4902 1.3s (ETA 4.9min)
[43/80] PV=8.0 seed=20260212 FAIL rmse=0.4563 4.4s (ETA 4.7min)
[44/80] PV=8.0 seed=20260213 FAIL rmse=0.4548 3.6s (ETA 4.6min)
[45/80] PV=8.0 seed=20260214 FAIL rmse=0.4060 1.9s (ETA 4.4min)
[46/80] PV=8.0 seed=20260210 FAIL rmse=0.4554 3.6s (ETA 4.2min)
[47/80] PV=8.0 seed=20260211 FAIL rmse=0.4902 1.3s (ETA 4.0min)
[48/80] PV=8.0 seed=20260212 FAIL rmse=0.4622 3.9s (ETA 3.8min)
[49/80] PV=8.0 seed=20260213 FAIL rmse=0.4476 3.2s (ETA 3.7min)
[50/80] PV=8.0 seed=20260214 FAIL rmse=0.4111 1.8s (ETA 3.5min)
[51/80] PV=8.0 seed=20260210 FAIL rmse=0.4561 3.0s (ETA 3.3min)
[52/80] PV=8.0 seed=20260211 FAIL rmse=0.4902 1.2s (ETA 3.2min)
[53/80] PV=8.0 seed=20260212 FAIL rmse=0.4563 3.3s (ETA 3.0min)
[54/80] PV=8.0 seed=20260213 FAIL rmse=0.4549 2.8s (ETA 2.9min)
[55/80] PV=8.0 seed=20260214 FAIL rmse=0.4110 1.6s (ETA 2.7min)
[56/80] PV=8.0 seed=20260210 FAIL rmse=0.4064 2.4s (ETA 2.6min)
[57/80] PV=8.0 seed=20260211 FAIL rmse=0.4905 1.0s (ETA 2.5min)
[58/80] PV=8.0 seed=20260212 FAIL rmse=0.4615 2.6s (ETA 2.3min)
[59/80] PV=8.0 seed=20260213 FAIL rmse=0.4396 2.1s (ETA 2.2min)
[60/80] PV=8.0 seed=20260214 FAIL rmse=0.3882 1.3s (ETA 2.1min)
[61/80] PV=10.0 seed=20260210 FAIL rmse=0.5719 2.5s (ETA 1.9min)
[62/80] PV=10.0 seed=20260211 FAIL rmse=0.6014 1.1s (ETA 1.8min)
[63/80] PV=10.0 seed=20260212 FAIL rmse=0.5297 2.3s (ETA 1.7min)
[64/80] PV=10.0 seed=20260213 FAIL rmse=0.5787 3.0s (ETA 1.6min)
[65/80] PV=10.0 seed=20260214 FAIL rmse=1.2054 1.8s (ETA 1.5min)
[66/80] PV=10.0 seed=20260210 FAIL rmse=0.5719 2.7s (ETA 1.4min)
[67/80] PV=10.0 seed=20260211 FAIL rmse=0.6093 1.2s (ETA 1.2min)
[68/80] PV=10.0 seed=20260212 FAIL rmse=0.5368 2.2s (ETA 1.1min)
[69/80] PV=10.0 seed=20260213 FAIL rmse=0.5895 2.4s (ETA 1.0min)
[70/80] PV=10.0 seed=20260214 FAIL rmse=1.2052 1.3s (ETA 0.9min)
[71/80] PV=10.0 seed=20260210 FAIL rmse=0.5719 2.0s (ETA 0.8min)
[72/80] PV=10.0 seed=20260211 FAIL rmse=0.6011 1.0s (ETA 0.7min)
[73/80] PV=10.0 seed=20260212 FAIL rmse=0.5034 1.9s (ETA 0.6min)
[74/80] PV=10.0 seed=20260213 FAIL rmse=0.5868 2.0s (ETA 0.5min)
[75/80] PV=10.0 seed=20260214 FAIL rmse=0.4749 1.2s (ETA 0.4min)
[76/80] PV=10.0 seed=20260210 FAIL rmse=0.5718 1.6s (ETA 0.4min)
[77/80] PV=10.0 seed=20260211 FAIL rmse=0.5990 0.7s (ETA 0.3min)
[78/80] PV=10.0 seed=20260212 FAIL rmse=0.5556 1.5s (ETA 0.2min)
[79/80] PV=10.0 seed=20260213 FAIL rmse=0.5780 1.7s (ETA 0.1min)
[80/80] PV=10.0 seed=20260214 FAIL rmse=0.4749 1.2s (ETA 0.0min)

--- Per-PV Summary ---
ASM PV=2.0: sr=1.00, mean_rmse=0.1049
ASM PV=5.0: sr=0.00, mean_rmse=nan
ASM PV=8.0: sr=0.00, mean_rmse=nan
ASM PV=10.0: sr=0.00, mean_rmse=nan

SOLVER=asm rows=80 out=outputs/tables/missing_spot_no_oracle_quick_asm_results.csv
STAGE_DONE run_asm config=configs/exp_missing_spot_no_oracle_quick.yaml
saved outputs/tables/missing_spot_no_oracle_quick_summary_by_ratio.csv
STAGE_DONE no_oracle_quick_missing
STAGE_START no_oracle_quick_param
STAGE_START run_baseline config=configs/exp_param_scan_no_oracle_quick.yaml
Terminated
